{
 "artifacts": [
  {
   "id": "880965c7-95ff-483c-80bb-22799bbbee63",
   "name": "alpine-baselayout",
   "version": "3.2.0-r16",
   "type": "apk",
   "foundBy": "apkdb-cataloger",
   "locations": [
    {
     "path": "/lib/apk/db/installed",
     "layerID": "sha256:e2eb06d8af8218cfec8210147357a68b7e13f7c485b991c288c2d01dc228bb68"
    }
   ],
   "licenses": [
    "GPL-2.0-only"
   ],
   "language": "",
   "cpes": [
    "cpe:2.3:a:alpine-baselayout:alpine-baselayout:3.2.0-r16:*:*:*:*:*:*:*",
    "cpe:2.3:a:alpine-baselayout:alpine_baselayout:3.2.0-r16:*:*:*:*:*:*:*",
    "cpe:2.3:a:alpine_baselayout:alpine-baselayout:3.2.0-r16:*:*:*:*:*:*:*",
    "cpe:2.3:a:alpine_baselayout:alpine_baselayout:3.2.0-r16:*:*:*:*:*:*:*",
    "cpe:2.3:a:alpine:alpine-baselayout:3.2.0-r16:*:*:*:*:*:*:*",
    "cpe:2.3:a:alpine:alpine_baselayout:3.2.0-r16:*:*:*:*:*:*:*"
   ],
   "purl": "pkg:apk/alpine/alpine-baselayout@3.2.0-r16?arch=x86_64",
   "metadataType": "ApkMetadata",
   "metadata": {
    "package": "alpine-baselayout",
    "originPackage": "alpine-baselayout",
    "maintainer": "Natanael Copa <ncopa@alpinelinux.org>",
    "version": "3.2.0-r16",
    "license": "GPL-2.0-only",
    "architecture": "x86_64",
    "url": "https://git.alpinelinux.org/cgit/aports/tree/main/alpine-baselayout",
    "description": "Alpine base dir structure and init scripts",
    "size": 20716,
    "installedSize": 413696,
    "pullDependencies": "/bin/sh so:libc.musl-x86_64.so.1",
    "pullChecksum": "Q1UJtB9cNV4r+/VbxySkEei++qbho=",
    "gitCommitOfApkPort": "8a8c96a0ea2fcd824c361aa4438763fa33ee8ca0",
    "files": [
     {
      "path": "/dev"
     },
     {
      "path": "/dev/pts"
     },
     {
      "path": "/dev/shm"
     },
     {
      "path": "/etc"
     },
     {
      "path": "/etc/fstab",
      "digest": {
       "algorithm": "sha1",
       "value": "Q11Q7hNe8QpDS531guqCdrXBzoA/o="
      }
     },
     {
      "path": "/etc/group",
      "digest": {
       "algorithm": "sha1",
       "value": "Q13K+olJg5ayzHSVNUkggZJXuB+9Y="
      }
     },
     {
      "path": "/etc/hostname",
      "digest": {
       "algorithm": "sha1",
       "value": "Q16nVwYVXP/tChvUPdukVD2ifXOmc="
      }
     },
     {
      "path": "/etc/hosts",
      "digest": {
       "algorithm": "sha1",
       "value": "Q1BD6zJKZTRWyqGnPi4tSfd3krsMU="
      }
     },
     {
      "path": "/etc/inittab",
      "digest": {
       "algorithm": "sha1",
       "value": "Q1TsthbhW7QzWRe1E/NKwTOuD4pHc="
      }
     },
     {
      "path": "/etc/modules",
      "digest": {
       "algorithm": "sha1",
       "value": "Q1toogjUipHGcMgECgPJX64SwUT1M="
      }
     },
     {
      "path": "/etc/motd",
      "digest": {
       "algorithm": "sha1",
       "value": "Q1XmduVVNURHQ27TvYp1Lr5TMtFcA="
      }
     },
     {
      "path": "/etc/mtab",
      "ownerUid": "0",
      "ownerGid": "0",
      "permissions": "777",
      "digest": {
       "algorithm": "sha1",
       "value": "Q1kiljhXXH1LlQroHsEJIkPZg2eiw="
      }
     },
     {
      "path": "/etc/passwd",
      "digest": {
       "algorithm": "sha1",
       "value": "Q1TchuuLUfur0izvfZQZxgN/LJhB8="
      }
     },
     {
      "path": "/etc/profile",
      "digest": {
       "algorithm": "sha1",
       "value": "Q1VmHPWPjjvz4oCsbmYCUB4uWpSkc="
      }
     },
     {
      "path": "/etc/protocols",
      "digest": {
       "algorithm": "sha1",
       "value": "Q1omKlp3vgGq2ZqYzyD/KHNdo8rDc="
      }
     },
     {
      "path": "/etc/services",
      "digest": {
       "algorithm": "sha1",
       "value": "Q19WLCv5ItKg4MH7RWfNRh1I7byQc="
      }
     },
     {
      "path": "/etc/shadow",
      "ownerUid": "0",
      "ownerGid": "42",
      "permissions": "640",
      "digest": {
       "algorithm": "sha1",
       "value": "Q1ltrPIAW2zHeDiajsex2Bdmq3uqA="
      }
     },
     {
      "path": "/etc/shells",
      "digest": {
       "algorithm": "sha1",
       "value": "Q1ojm2YdpCJ6B/apGDaZ/Sdb2xJkA="
      }
     },
     {
      "path": "/etc/sysctl.conf",
      "digest": {
       "algorithm": "sha1",
       "value": "Q14upz3tfnNxZkIEsUhWn7Xoiw96g="
      }
     },
     {
      "path": "/etc/apk"
     },
     {
      "path": "/etc/conf.d"
     },
     {
      "path": "/etc/crontabs"
     },
     {
      "path": "/etc/crontabs/root",
      "ownerUid": "0",
      "ownerGid": "0",
      "permissions": "600",
      "digest": {
       "algorithm": "sha1",
       "value": "Q1vfk1apUWI4yLJGhhNRd0kJixfvY="
      }
     },
     {
      "path": "/etc/init.d"
     },
     {
      "path": "/etc/modprobe.d"
     },
     {
      "path": "/etc/modprobe.d/aliases.conf",
      "digest": {
       "algorithm": "sha1",
       "value": "Q1WUbh6TBYNVK7e4Y+uUvLs/7viqk="
      }
     },
     {
      "path": "/etc/modprobe.d/blacklist.conf",
      "digest": {
       "algorithm": "sha1",
       "value": "Q1xxYGU6S6TLQvb7ervPrWWwAWqMg="
      }
     },
     {
      "path": "/etc/modprobe.d/i386.conf",
      "digest": {
       "algorithm": "sha1",
       "value": "Q1pnay/njn6ol9cCssL7KiZZ8etlc="
      }
     },
     {
      "path": "/etc/modprobe.d/kms.conf",
      "digest": {
       "algorithm": "sha1",
       "value": "Q1ynbLn3GYDpvajba/ldp1niayeog="
      }
     },
     {
      "path": "/etc/modules-load.d"
     },
     {
      "path": "/etc/network"
     },
     {
      "path": "/etc/network/if-down.d"
     },
     {
      "path": "/etc/network/if-post-down.d"
     },
     {
      "path": "/etc/network/if-pre-up.d"
     },
     {
      "path": "/etc/network/if-up.d"
     },
     {
      "path": "/etc/opt"
     },
     {
      "path": "/etc/periodic"
     },
     {
      "path": "/etc/periodic/15min"
     },
     {
      "path": "/etc/periodic/daily"
     },
     {
      "path": "/etc/periodic/hourly"
     },
     {
      "path": "/etc/periodic/monthly"
     },
     {
      "path": "/etc/periodic/weekly"
     },
     {
      "path": "/etc/profile.d"
     },
     {
      "path": "/etc/profile.d/README",
      "digest": {
       "algorithm": "sha1",
       "value": "Q135OWsCzzvnB2fmFx62kbqm1Ax1k="
      }
     },
     {
      "path": "/etc/profile.d/color_prompt.sh.disabled",
      "digest": {
       "algorithm": "sha1",
       "value": "Q10wL23GuSCVfumMRgakabUI6EsSk="
      }
     },
     {
      "path": "/etc/profile.d/locale.sh",
      "digest": {
       "algorithm": "sha1",
       "value": "Q1S8j+WW71mWxfVy8ythqU7HUVoBw="
      }
     },
     {
      "path": "/etc/sysctl.d"
     },
     {
      "path": "/home"
     },
     {
      "path": "/lib"
     },
     {
      "path": "/lib/firmware"
     },
     {
      "path": "/lib/mdev"
     },
     {
      "path": "/lib/modules-load.d"
     },
     {
      "path": "/lib/sysctl.d"
     },
     {
      "path": "/lib/sysctl.d/00-alpine.conf",
      "digest": {
       "algorithm": "sha1",
       "value": "Q1HpElzW1xEgmKfERtTy7oommnq6c="
      }
     },
     {
      "path": "/media"
     },
     {
      "path": "/media/cdrom"
     },
     {
      "path": "/media/floppy"
     },
     {
      "path": "/media/usb"
     },
     {
      "path": "/mnt"
     },
     {
      "path": "/opt"
     },
     {
      "path": "/proc"
     },
     {
      "path": "/root",
      "ownerUid": "0",
      "ownerGid": "0",
      "permissions": "700"
     },
     {
      "path": "/run"
     },
     {
      "path": "/sbin"
     },
     {
      "path": "/sbin/mkmntdirs",
      "ownerUid": "0",
      "ownerGid": "0",
      "permissions": "755",
      "digest": {
       "algorithm": "sha1",
       "value": "Q1VcFI6coRl6HWWVShMW+G5Sb3JH8="
      }
     },
     {
      "path": "/srv"
     },
     {
      "path": "/sys"
     },
     {
      "path": "/tmp",
      "ownerUid": "0",
      "ownerGid": "0",
      "permissions": "1777"
     },
     {
      "path": "/usr"
     },
     {
      "path": "/usr/lib"
     },
     {
      "path": "/usr/lib/modules-load.d"
     },
     {
      "path": "/usr/local"
     },
     {
      "path": "/usr/local/bin"
     },
     {
      "path": "/usr/local/lib"
     },
     {
      "path": "/usr/local/share"
     },
     {
      "path": "/usr/sbin"
     },
     {
      "path": "/usr/share"
     },
     {
      "path": "/usr/share/man"
     },
     {
      "path": "/usr/share/misc"
     },
     {
      "path": "/var"
     },
     {
      "path": "/var/run",
      "ownerUid": "0",
      "ownerGid": "0",
      "permissions": "777",
      "digest": {
       "algorithm": "sha1",
       "value": "Q11/SNZz/8cK2dSKK+cJpVrZIuF4Q="
      }
     },
     {
      "path": "/var/cache"
     },
     {
      "path": "/var/cache/misc"
     },
     {
      "path": "/var/empty",
      "ownerUid": "0",
      "ownerGid": "0",
      "permissions": "555"
     },
     {
      "path": "/var/lib"
     },
     {
      "path": "/var/lib/misc"
     },
     {
      "path": "/var/local"
     },
     {
      "path": "/var/lock"
     },
     {
      "path": "/var/lock/subsys"
     },
     {
      "path": "/var/log"
     },
     {
      "path": "/var/mail"
     },
     {
      "path": "/var/opt"
     },
     {
      "path": "/var/spool"
     },
     {
      "path": "/var/spool/mail",
      "ownerUid": "0",
      "ownerGid": "0",
      "permissions": "777",
      "digest": {
       "algorithm": "sha1",
       "value": "Q1dzbdazYZA2nTzSIG3YyNw7d4Juc="
      }
     },
     {
      "path": "/var/spool/cron"
     },
     {
      "path": "/var/spool/cron/crontabs",
      "ownerUid": "0",
      "ownerGid": "0",
      "permissions": "777",
      "digest": {
       "algorithm": "sha1",
       "value": "Q1OFZt+ZMp7j0Gny0rqSKuWJyqYmA="
      }
     },
     {
      "path": "/var/tmp",
      "ownerUid": "0",
      "ownerGid": "0",
      "permissions": "1777"
     }
    ]
   }
  },
  {
   "id": "8dbd8f4d-c13f-4120-8c2b-4596e5c46fce",
   "name": "alpine-keys",
   "version": "2.3-r1",
   "type": "apk",
   "foundBy": "apkdb-cataloger",
   "locations": [
    {
     "path": "/lib/apk/db/installed",